{
  "norm_set_id": "ops-moderation-v1",
  "village_id": "ops",
  "title": "Ops moderation baseline",
  "version": "1.0.0",
  "description": "Baseline intake and review governance for the ops village.",
  "authors": ["alice"],
  "created_at": "2026-03-16T00:00:00Z",
  "norms": [
    {
      "norm_id": "external-bundles-reviewed",
      "statement": "External claim bundles must be quarantined before acceptance.",
      "category": "intake",
      "enforcement": "required",
      "tags": ["intake", "quarantine"],
      "compile_to": [
        {"key": "quarantine_external_bundles", "value": true}
      ]
    },
    {
      "norm_id": "moderator-dual-review",
      "statement": "At least two moderators must approve quarantined bundles.",
      "category": "review",
      "enforcement": "required",
      "tags": ["review"],
      "compile_to": [
        {"key": "review_min_approvals", "value": 2}
      ]
    },
    {
      "norm_id": "signed-policy-updates",
      "statement": "Policy updates must carry signatures from approved operators.",
      "category": "governance",
      "enforcement": "required",
      "tags": ["signatures"],
      "compile_to": [
        {"key": "require_policy_signature", "value": true},
        {"key": "policy_signature_threshold_m", "value": 2}
      ]
    }
  ]
}
